{
  "actor_id": "principal_reviewer_001",
  "actor_type": "principal",
  "agent_client_id": "agent_client_codex_001",
  "artifact_refs": [
    {
      "artifact_id": "artifact_sha256_aaaaaaaaaaaaaaaaaaaaaaaaaaaaaaaaaaaaaaaaaaaaaaaaaaaaaaaaaaaaaaaa",
      "availability": "available",
      "classification": "internal",
      "content_sha256": "sha256:aaaaaaaaaaaaaaaaaaaaaaaaaaaaaaaaaaaaaaaaaaaaaaaaaaaaaaaaaaaaaaaa",
      "encryption_key_id": null,
      "media_type": "application/json",
      "retention_policy_id": "retention_engineering_memory",
      "size_bytes": 418
    }
  ],
  "authorization_decision_id": "authorization_decision_001",
  "causation_id": null,
  "classification": "internal",
  "correlation_id": "correlation_001",
  "environment_id": "environment_local",
  "event_id": "evt_memory_proposed_001",
  "event_kind": "domain",
  "event_sha256": "sha256:e117d4c5089f423f17281a164c56985c8eb022656ad9959bf86627489404c07e",
  "event_type": "tbm.memory.proposed",
  "event_version": 1,
  "global_position": 1,
  "idempotency_key_sha256": "sha256:bbbbbbbbbbbbbbbbbbbbbbbbbbbbbbbbbbbbbbbbbbbbbbbbbbbbbbbbbbbbbbbb",
  "occurred_at": "2026-07-31T12:00:00Z",
  "organization_id": "organization_001",
  "origin": "native",
  "payload": {
    "memory_revision_id": "memory_revision_001",
    "proposal_kind": "lesson",
    "scope_id": "repository_001"
  },
  "payload_schema": "tbm.memory.proposed.v1",
  "payload_sha256": "sha256:3757612f2507468c293c7643b6f004ee95f39d913da4ecc8babef7f19da5e3de",
  "previous_stream_event_sha256": null,
  "principal_id": "principal_reviewer_001",
  "producer": "trace_backed_memory",
  "producer_version": "0.1.0",
  "protocol_version": "tbm.event.v1",
  "recorded_at": "2026-07-31T12:00:01Z",
  "repository_id": "repository_001",
  "request_id": "request_001",
  "request_sha256": "sha256:cccccccccccccccccccccccccccccccccccccccccccccccccccccccccccccccc",
  "retention_policy_id": "retention_engineering_memory",
  "source": null,
  "stream_id": "memory_revision_001",
  "stream_type": "memory_revision",
  "stream_version": 1,
  "tenant_id": "tenant_001"
}
